{
  "identity": {
    "username": "test-user",
    "groups": ["Admins"],
    "type": "person"
  },
  "resource": {
    "type": "ssh",
    "name": "test-server-01",
    "sensitivity": "high"
  },
  "protocol": {
    "name": "ssh"
  },
  "source": {
    "ip": "10.0.0.1",
    "geo": "US"
  },
  "device": {
    "managed": true,
    "compliant": true
  },
  "context": {
    "mfa_recent": false,
    "interactive": true
  }
}
